Question Number,Question (English),Question (Hindi),Option A (English),Option A (Hindi),Option B (English),Option B (Hindi),Option C (English),Option C (Hindi),Option D (English),Option D (Hindi),Correct Answer (English),Correct Answer (Hindi)
50,"If you discover a suspicious device you have to inform your supervisor by use of radio communication how will you communicate?","यदि आपको एक संदिग्ध उपकरण का पता चलता है तो आपको रेडियो संचार के उपयोग से अपने पर्यवेक्षक को सूचित करना होगा कि आप कैसे संचार करेंगे?","Cannot establish R/T communication because command mechanism can be used","आर/टी संचार स्थापित नहीं कर सकता क्योंकि कमांड तंत्र का उपयोग किया जा सकता है","Cannot establish R/T communication because ambient mechanism can be used","आर/टी संचार स्थापित नहीं कर सकता क्योंकि परिवेश तंत्र का उपयोग किया जा सकता है","Establish R/T communication from a safe distance of 100 mtr","100 मीटर की सुरक्षित दूरी से आर/टी संचार स्थापित करें","Establish R/T communication from a safe distance of 25 mtr","25 मीटर की सुरक्षित दूरी से आर/टी संचार स्थापित करें","Establish R/T communication from a safe distance of 100 mtr","100 मीटर की सुरक्षित दूरी से आर/टी संचार स्थापित करें"
51,"What will be your immediate action when you find some suspicious object?","जब आपको कोई संदिग्ध वस्तु मिलती है तो आपकी तत्काल कार्रवाई क्या होगी?","Inform the CASO wait for further instruction","CASO को सूचित करें और आगे के निर्देश की प्रतीक्षा करें","Touch and verify wheather it is suspicious or not","स्पर्श करें और सत्यापित करें कि यह संदिग्ध है या नहीं","Mark the area evacuate the area and inform to all as per SOP","क्षेत्र को चिन्हित कर क्षेत्र को खाली करें और एसओपी के अनुसार सभी को सूचित करें","Only evacuate items which are near to suspicious object","केवल उन वस्तुओं को खाली करें जो संदिग्ध वस्तु के पास हों","Mark the area evacuate the area and inform to all as per SOP","क्षेत्र को चिन्हित कर क्षेत्र को खाली करें और एसओपी के अनुसार सभी को सूचित करें"
52,"In case of bomb threat you are going for search of TB but you don't know the topography of the area what will you do?","बम की धमकी के मामले में आप टीबी की खोज के लिए जा रहे हैं लेकिन आपको क्षेत्र की स्थलाकृति नहीं पता है तो आप क्या करेंगे?","No need to knows the topography countinue the search","स्थलाकृति को जानने की आवश्यकता नहीं है, खोज जारी रखें","Take help the staff familiar with the location","स्थान से परिचित कर्मचारियों की मदद लें","Can start search without familiar to Terminal Building","टर्मिनल बिल्डिंग से परिचित हुए बिना खोज शुरू कर सकते हैं","Familiarization is not yet all important for search","खोज के लिए परिचित होना अभी तक महत्वपूर्ण नहीं है","Take help the staff familiar with the location","स्थान से परिचित कर्मचारियों की मदद लें"
53,"Before search of building begins, if a searcher finds anything unusual the coordinator will decide","भवन की तलाशी शुरू होने से पहले, यदि खोजकर्ता को कुछ असामान्य लगता है तो समन्वयक निर्णय करेगा","To evacuate the building","इमारत को खाली करने के लिए","Not to evacuate the building","भवन को खाली नहीं करना है","Cancel the search","खोज रद्द करें","Ignore any unusual","किसी असामान्य बात पर ध्यान न दें","To evacuate the building","इमारत को खाली करने के लिए"
54,"A bomb threat comes, search team conducts a search and finds nothing suspicious. What would be the course of action?","बम की धमकी आती है, खोज दल तलाशी लेता है और कुछ भी संदिग्ध नहीं पाता है। कार्रवाई का तरीका क्या होगा?","Inform co-ordinator and mark area clear","समन्वयक को सूचित करें और क्षेत्र को स्पष्ट चिह्नित करें","Repeat the search","खोज दोहराएँ","No action will be taken","कोई कार्रवाई नहीं की जाएगी","No action is required for Bomb threat","बम की धमकी के लिए किसी कार्रवाई की आवश्यकता नहीं है","Inform co-ordinator and mark area clear","समन्वयक को सूचित करें और क्षेत्र को स्पष्ट चिह्नित करें"
55,"In a search of a room if weapon is detected, what action as a searcher should do?","एक कमरे की तलाशी में यदि हथियार का पता चलता है, तो एक खोजी के रूप में क्या कार्रवाई करनी चाहिए?","Immediately safe guard the weapon and notify the search co-ordinator","हथियार को तुरंत सुरक्षित रखें और खोज समन्वयक को सूचित करें","Inform the CASO and Police immediately","तुरंत कासो व पुलिस को सूचित करें","Inform the local Police immediately","तुरंत स्थानीय पुलिस को सूचित करें","No need to inform any the searcher team would done the matter later us","किसी को बताने की जरूरत नहीं है कि खोजकर्ता टीम बाद में हमसे बात करेगी","Immediately safe guard the weapon and notify the search co-ordinator","हथियार को तुरंत सुरक्षित रखें और खोज समन्वयक को सूचित करें"
56,"Before start of patrolling if petrol member of the team found an IED in a vehicle what a team should do?","गश्त शुरू करने से पहले यदि टीम के पेट्रोल सदस्य को वाहन में आईईडी मिला तो टीम को क्या करना चाहिए?","Allow the vehicle to go inside","वाहन को अंदर जाने दें","Inform team leader and do as per SOP","टीम लीडर को सूचित करें और एसओपी के अनुसार करें","Never allow the vehicle go inside airport any condition","किसी भी हालत में वाहन को एयरपोर्ट के अंदर न जाने दें","No need of any additional action required","किसी अतिरिक्त कार्रवाई की आवश्यकता नहीं है","Inform team leader and do as per SOP","टीम लीडर को सूचित करें और एसओपी के अनुसार करें"
57,"A vehicle moving within the SRA or controlled area without switch on anti- collision light, if a patrol party found it. What action they will take immediately?","एक वाहन एसआरए या नियंत्रित क्षेत्र के भीतर बिना टकराने वाली रोशनी के स्विच के बिना चल रहा है, अगर एक गश्ती दल ने इसे पाया। वे तुरंत क्या कार्रवाई करेंगे?","Stop the vehicle and takeout from area and do as per SOP","वाहन को रोकें और क्षेत्र से टेकआउट करें और एसओपी के अनुसार करें","No need to disturb a vehicle","किसी वाहन को डिस्टर्ब करने की जरूरत नहीं है","Report about the incident to concern organization","संबंधित संगठन को घटना के बारे में रिपोर्ट करें","Ignore it because it is not security concerned","इसे अनदेखा करें क्योंकि यह सुरक्षा से संबंधित नहीं है","Stop the vehicle and takeout from area and do as per SOP","वाहन को रोकें और क्षेत्र से टेकआउट करें और एसओपी के अनुसार करें"
58,"An employee reported for duty at apron without high visible jacket what action ASG will take?","एक कर्मचारी ने बिना हाई विजिबल जैकेट के एप्रन पर ड्यूटी के लिए रिपोर्ट किया, एएसजी क्या कार्रवाई करेगा?","Allow the employee","कर्मचारी को अनुमति दें","Don't allow the employee and inform team leader and do as per SOP","कर्मचारी को अनुमति न दें और टीम लीडर को सूचित करें और एसओपी के अनुसार करें","Detain the employee","कर्मचारी को हिरासत में लें","To provide high visible jacket","उच्च दृश्यमान जैकेट प्रदान करने के लिए","Don't allow the employee and inform team leader and do as per SOP","कर्मचारी को अनुमति न दें और टीम लीडर को सूचित करें और एसओपी के अनुसार करें"
59,"If a person found during patrol without SRA pass what action a patrol party to take?","यदि कोई व्यक्ति एसआरए के बिना गश्त के दौरान पाया जाता है तो एक गश्ती दल क्या कार्रवाई करेगा?","Warm him not to do so again","उसे दोबारा ऐसा न करने की चेतावनी दें","Expelled him from the premises of airport","उसे हवाई अड्डे के परिसर से बाहर निकाल दिया","Detain him and call Police","उसे हिरासत में लें और पुलिस को बुलाएं","Work as per SOP","एसओपी के अनुसार काम करें","Work as per SOP","एसओपी के अनुसार काम करें"
60,"In case of sudden light failure a radio communication should be done on what interval?","अचानक प्रकाश की विफलता के मामले में एक रेडियो संचार किस अंतराल पर किया जाना चाहिए?","Communication will be established every 60 min","हर 60 मिनट में संचार स्थापित किया जाएगा","Communication will be established every 30 min","हर 30 मिनट में संचार स्थापित किया जाएगा","communication will be continued till light comes","प्रकाश आने तक संचार जारी रहेगा","No communication should be established","कोई संचार स्थापित नहीं किया जाना चाहिए","Communication will be established every 30 min","हर 30 मिनट में संचार स्थापित किया जाएगा"
61,"What action to be taken on attempt of unauthorized access to SRA?","","Inform duty team leader and police","","Inform team leader","","No action to be taken","","Inform security manager","","Inform duty team leader and police",""
62,"In case of broken fencing what would be the task of patrol party?","बाड़ टूट जाने की स्थिति में गश्ती दल का क्या कार्य होगा?","Initiate fencing repair","बाड़ की मरम्मत शुरू करें","Inform airport operator for repair","मरम्मत के लिए एयरपोर्ट संचालक को सूचित करें","Team leader to be intimated and work as per SOP","टीम लीडर को सूचित किया जाए और एसओपी के अनुसार कार्य किया जाए","Deploy the team near broken fencing","टीम को टूटी फेंसिंग के पास तैनात करें","Team leader to be intimated and work as per SOP","टीम लीडर को सूचित किया जाए और एसओपी के अनुसार कार्य किया जाए"
63,"If a hearing disability person indicates that he does not understand the instructions, what the screener should do?","यदि सुनने में अक्षम व्यक्ति इंगित करता है कि वह निर्देशों को नहीं समझता है, तो स्क्रीनर को क्या करना चाहिए?","look directly at him and repeat information slowly by screener","उसे सीधे देखें और स्क्रीनर द्वारा धीरे-धीरे जानकारी को दोहराएं","No need to see any disability","किसी अक्षमता को देखने की जरूरत नहीं है","Ignore the disability feature and continue screening","विकलांगता के लक्षण पर ध्यान न दें और स्क्रीनिंग जारी रखें","Will Apply less concentration performing and screening on humanity ground","मानवता के धरातल पर प्रदर्शन और स्क्रीनिंग में कम एकाग्रता लगाएंगे","look directly at him and repeat information slowly by screener","उसे सीधे देखें और स्क्रीनर द्वारा धीरे-धीरे जानकारी को दोहराएं"
64,"If a pax comes to you and says that he is a diabetic patient. He is having unused syringes in bulk. What is your course of action?","यदि कोई व्यक्ति आपके पास आकर कहे कि वह मधुमेह का रोगी है। उसके पास बड़ी मात्रा में अप्रयुक्त सीरिंजें हैं। आपकी कार्रवाई का तरीका क्या है?","Detain the passenger and inform the supervisor","यात्री को रोकें और पर्यवेक्षक को सूचित करें","Ask the pax to carry the syringes in checked baggage","पैक्स को चेक किए गए सामान में सीरिंज ले जाने के लिए कहें","See the documents and allow in carry-on baggage","दस्तावेज़ देखें और कैरी-ऑन बैगेज में अनुमति दें","Syringe is not a prohibited item, so it will be allowed","सिरिंज प्रतिबंधित वस्तु नहीं है, इसलिए इसकी अनुमति दी जाएगी","See the documents and allow in carry-on baggage","दस्तावेज़ देखें और कैरी-ऑन बैगेज में अनुमति दें"
65,"A pax comes and says that he has implanted pacemaker and he does not want to walk through DFMD?","एक पैक्स आता है और कहता है कि उसने पेसमेकर लगाया है और वह DFMD से नहीं चलना चाहता है?","Follow' no search, no fly'","'नो सर्च, नो फ्लाई' को फॉलो करें","Convince the passenger that DFMD is safe for pacemaker","यात्री को समझाएं कि डीएफएमडी पेसमेकर के लिए सुरक्षित है","Conduct pat down search","पैट डाउन सर्च करें","Both B and C","","Both B and C",""
66,"A Passenger reported for screening having crutches is not fit through the X-Ray machine what the screener should do?","स्क्रीनिंग के लिए रिपोर्ट किया गया एक यात्री बैसाखी के साथ एक्स-रे मशीन के माध्यम से फिट नहीं है, स्क्रीनर को क्या करना चाहिए?","Hand inspection of equipment will be done","उपकरणों का हाथ से निरीक्षण किया जाएगा","Passenger will not be allowed","यात्री की अनुमति नहीं होगी","On humanity ground, that is allowed","मानवता के आधार पर, इसकी अनुमति है","Passenger will be allowed without crutches","यात्री को बिना बैसाखी के जाने दिया जाएगा","Hand inspection of equipment will be done","उपकरणों का हाथ से निरीक्षण किया जाएगा"
67,"A screener found insulin pump in the hand baggage of pax while x-ray screening. what he should do?","एक स्क्रिनर को एक्स-रे स्क्रीनिंग के दौरान पैक्स के हैंड बैगेज में इंसुलिन पंप मिला। उसे क्या करना चाहिए?","Insulin is not prohibited item so allow the passenger","इंसुलिन निषिद्ध वस्तु नहीं है इसलिए यात्री को अनुमति दें","Insulin is not allowed","इंसुलिन की अनुमति नहीं है","Insulin should be carried in registered baggage","इंसुलिन को पंजीकृत सामान में ले जाना चाहिए","Ensure insulin must accompany printed label","सुनिश्चित करें कि इंसुलिन मुद्रित लेबल के साथ होना चाहिए","Ensure insulin must accompany printed label","सुनिश्चित करें कि इंसुलिन मुद्रित लेबल के साथ होना चाहिए"
68,"A pregnant woman comes and denies to be screened through metal detector. What action would you take as a screener?","कोई गर्भवती महिला आती है और मेटल डिटेक्टर से जांच कराने से मना कर देती है। एक स्क्रिनर के रूप में आप क्या कार्रवाई करेंगे?","Don't allow without metal detector check","बिना मेटल डिटेक्टर जांच के अनुमति न दें","Convince that the metal detector is safe for pregnant woman","समझाएं कि मेटल डिटेक्टर गर्भवती महिला के लिए सुरक्षित है","Conduct pat down search","पैट डाउन सर्च करें","She is bound to go through metal detector","वह मेटल डिटेक्टर से गुजरने के लिए बाध्य है","Conduct pat down search","पैट डाउन सर्च करें"
69,"If a pax comes and demands for wheel chairs from a screener what he should do?","यदि कोई पैक्स आता है और स्क्रिनर से व्हील चेयर की मांग करता है तो उसे क्या करना चाहिए?","Don't provide because it is not security concern","प्रदान न करें क्योंकि यह सुरक्षा चिंता का विषय नहीं है","Don't hesitate to offer wheel chair","व्हील चेयर देने में संकोच न करें","Call airline staff to facilitate the passenger","यात्री की सुविधा के लिए एयरलाइन स्टाफ को कॉल करें","Ask the passenger to contact concerned airport operator","यात्री को संबंधित एयरपोर्ट ऑपरेटर से संपर्क करने के लिए कहें","Call airline staff to facilitate the passenger","यात्री की सुविधा के लिए एयरलाइन स्टाफ को कॉल करें"
70,"If a passenger becomes too violent, to be controlled, a restraint should be used on the passenger until the passenger is handed over to","यदि कोई यात्री इतना हिंसक हो जाता है कि नियंत्रित नहीं किया जा सकता है, तो यात्री को को सौंपे जाने तक यात्री पर संयम का प्रयोग किया जाना चाहिए।","ASG","","Immigration","","law enforcement authority","","Airline security","","law enforcement authority",""
71,"Miss Ragini travels from Delhi to Hyderabad on jet airways flight 9W 213 and from Hyderabad to Tirupati on the same flight She will be termed as","सुश्री रागिनी जेट एयरवेज की उड़ान 9W 213 में दिल्ली से हैदराबाद की यात्रा करती हैं और उसी उड़ान से हैदराबाद से तिरुपति की यात्रा करती हैं, उन्हें कहा जाएगा","Interline passenger","","Transfer passenger","","Transit","","Inline","","Transit",""
72,"Mr. Rajesh travels from Delhi to Hyderabad on jet airways flight 9W 213 and from Hyderabad to Tirupati on 9W 224 the same flight he will be termed as","श्री राजेश जेट एयरवेज की उड़ान 9W 213 पर दिल्ली से हैदराबाद की यात्रा करते हैं और हैदराबाद से तिरुपति की यात्रा 9W 224 उसी उड़ान से करते हैं, उन्हें कहा जाएगा","Interline passenger","","Transfer passenger","","Transit","","Inline","","Transfer passenger",""
73,"Miss Ranjeeta travels from Delhi to Hyderabad on jet airways flight 9W 213 and from Hyderabad to Tirupati on the IC 2121 she will be termed as","कुमारी रंजीता जेट एयरवेज की उड़ान 9W 213 में दिल्ली से हैदराबाद की यात्रा करती हैं और IC 2121 पर हैदराबाद से तिरुपति की यात्रा करती हैं, उन्हें कहा जाएगा","Interline passenger","","Transfer passenger","","Transit","","Inline","","Interline passenger",""
